{
  "$schema": "http://json-schema.org/draft-07/schema#",
  "$id": "urn:shopping-cli:candidate-agent:1.0",
  "title": "CandidateAgent",
  "description": "Public CandidateAgent DTO (§8.2, §21). A Candidate is a discoverable commerce agent, NOT a verified live identity. Only §3.4 MAY-expose fields may appear; private merchant state is never part of this DTO.",
  "type": "object",
  "properties": {
    "catalog_agent_id": {
      "type": "string",
      "minLength": 1,
      "description": "Stable catalog identifier for the candidate."
    },
    "merchant": {
      "type": "object",
      "properties": {
        "id": {
          "type": "string"
        },
        "name": {
          "type": "string"
        },
        "city": {
          "type": "string"
        },
        "service_area": {
          "type": "string"
        },
        "domain": {
          "type": "string"
        },
        "tags": {
          "type": "array",
          "items": {
            "type": "string"
          }
        }
      },
      "required": [
        "id",
        "name"
      ],
      "additionalProperties": false
    },
    "discovery": {
      "type": "object",
      "properties": {
        "agent_card_url": {
          "type": "string"
        },
        "ucp_profile_url": {
          "type": "string"
        },
        "a2a_urls": {
          "type": "array",
          "items": {
            "type": "string"
          }
        }
      },
      "additionalProperties": false
    },
    "protocols": {
      "type": "object",
      "description": "Map of protocol name → advertised protocol versions.",
      "additionalProperties": {
        "type": "array",
        "items": {
          "type": "string"
        }
      }
    },
    "capabilities": {
      "type": "array",
      "items": {
        "type": "string",
        "minLength": 1
      },
      "description": "Fully-qualified capability identifiers (§8.2). When a namespace is present it is joined with ':' before the capability id, e.g. 'com.shopping.agent.capability:catalog'."
    },
    "skills": {
      "type": "array",
      "items": {
        "type": "object",
        "properties": {
          "skill_id": {
            "type": "string"
          },
          "name": {
            "type": "string"
          },
          "description": {
            "type": "string"
          },
          "tags": {
            "type": "array",
            "items": {
              "type": "string"
            }
          }
        },
        "required": [
          "skill_id",
          "name"
        ],
        "additionalProperties": false
      }
    },
    "verification": {
      "type": "object",
      "properties": {
        "status": {
          "type": "string",
          "description": "Verification status. Known values: discovered, profile_valid, domain_verified, agent_verified, commerce_verified, stale, unreachable, suspended, rejected (§6 state machine)."
        },
        "last_verified_at": {
          "type": "string",
          "description": "ISO-8601 timestamp of the last verification."
        }
      },
      "required": [
        "status"
      ],
      "additionalProperties": false
    },
    "hosting": {
      "type": "object",
      "properties": {
        "mode": {
          "type": "string",
          "enum": [
            "direct",
            "hosted",
            "hybrid",
            "unknown",
            "direct_only",
            "hosted_only"
          ],
          "description": "Hosting mode (§22). Canonical values are direct_only / hosted_only / hybrid / unknown; 'direct' and 'hosted' are the legacy DB storage values retained for backward compatibility. See to_contract_hosting_mode for the normalization."
        }
      },
      "required": [
        "mode"
      ],
      "additionalProperties": false
    },
    "contract": {
      "type": "object",
      "properties": {
        "name": {
          "const": "candidate-agent",
          "description": "The DTO name, always 'candidate-agent'."
        },
        "version": {
          "const": "1.0",
          "description": "The additive-only contract version in use."
        }
      },
      "required": [
        "name",
        "version"
      ],
      "additionalProperties": false
    }
  },
  "required": [
    "catalog_agent_id",
    "verification",
    "hosting",
    "contract"
  ],
  "additionalProperties": false
}
